<?xml version="1.0" encoding="UTF-8"?>
<factura xmlns:xsi="http://www.w3.org/2001/XMLSchema-instance"
xsi:noNamespaceSchemaLocation="factura.xsd">
  <numar>1234</numar>
  <data>2023-05-15</data>
  <client>
    <nume>John Doe</nume>
    <adresa>Str. Exemplu, Nr. 10</adresa>
    <oras>Orasul Exemplu</oras>
  </client>
  <produse>
    <produs>
      <cod>001</cod>
      <denumire>Laptop</denumire>
      <pret>2500</pret>
      <cantitate>2</cantitate>
    </produs>
    <produs>
      <cod>002</cod>
      <denumire>Telefon</denumire>
      <pret>1200</pret>
      <cantitate>3</cantitate>
    </produs>
  </produse>
  <total>11100</total>
</factura>